{"schema_version":"0.1","document":{"schema_version":"0.1","source":{"format":"pub","format_version":"0x2c","source_hash":"6a825ba26ba35d6e885acdc62e859591ed37cb0ff7480b554b9cb362b644dfcf","byte_len":291840},"pages":[{"index":1,"id":"804583a0-a0fe-5dc0-a121-b5232db7e91e","width_emu":7560000,"height_emu":10692000},{"index":2,"id":"07d06e09-fc17-5b90-971f-7041f58d0f1e","width_emu":7560000,"height_emu":10692000},{"index":3,"id":"58ffa2e0-896e-5a40-806c-bd0184ea9c85","width_emu":7560000,"height_emu":10692000},{"index":4,"id":"782eec0b-01ee-5d9b-bad4-1ef749beb9b1","width_emu":7560000,"height_emu":10692000}],"stories":[{"id":"0439345d-6742-58f7-ad3e-4890fcf2c39f","text":"This week’s reminders:\r\rBring in your favorite book on Monday to share during “Getting To Know You Week”\r\rWrite out your 6 and 7 times tables every night to get ready for Friday’s test\r\rSpelling Bee Wednesday afternoon\r\r\r"},{"id":"15613e56-726e-5ae7-8c54-ec876c9bcfda","text":"Inside Story Headline\r"},{"id":"1e3f53bc-0945-549b-9985-8fbc00af17c7","text":"Caption describing picture or graphic.\r"},{"id":"2cefc3a1-cae2-5248-9791-1440085c62fe","text":"This week Strictly Jazz came to perform at our school.  \rThey had big, shiny instruments which they played very loudly. My favorite was the saxophone player.  \rHis name was Benny, and he played very fast and he danced when he played which looked funny. \rFor the start of one song, he was blowing plastic balls out of the top of his sax. \rThey were really good. Even though most of us hadn’t heard Jazz music before, everyone liked it and want them to come back again.\r"},{"id":"30fbcd27-23f4-5222-988a-5db30b2b92f7","text":"This story can fit 150-200 words.\rOne benefit of using your newsletter as a promotional tool is that you can reuse content from other marketing materials, such as press releases, market studies, and reports.\rWhile your main goal of distributing a newsletter might be to sell your product or service, the key to a successful newsletter is making it useful to your readers.\rA great way to add useful content to your newsletter is to develop and write your own articles, or include a calendar of upcoming events or a special offer that promotes a new product.\rYou can also research articles or find “filler” articles by accessing the World Wide Web. You can write about a variety of topics but try to keep your articles short.\rMuch of the content you put in your newsletter can also be used for your Web site. Microsoft Publisher offers a simple way to convert your newsletter to a Web publication. So, when you’re finished writing your newsletter, convert it to a Web site and post it.\r"},{"id":"310ef662-adaf-57c5-bc7f-51d12e6d9726","text":"This story can fit 150-200 words.\rOne benefit of using your newsletter as a promotional tool is that you can reuse content from other marketing materials, such as press releases, market studies, and reports.\rWhile your main goal of distributing a newsletter might be to sell your product or service, the key to a successful newsletter is making it useful to your readers.\rA great way to add useful content to your newsletter is to develop and write your own articles, or include a calendar of upcoming events or a special offer that promotes a new product.\rYou can also research articles or find “filler” articles by accessing the World Wide Web. You can write about a variety of topics but try to keep your articles short.\rMuch of the content you put in your newsletter can also be used for your Web site. Microsoft Publisher offers a simple way to convert your newsletter to a Web publication. So, when you’re finished writing your newsletter, convert it to a Web site and post it.\r"},{"id":"35833ae5-e7c1-5cf7-9cb9-a1a38776bc5d","text":"We’re on the Web!\r\t\t\t\t\thttp://www.contoso.com/\r"},{"id":"359faf62-4c98-5241-a54c-ec30a878987a","text":"Inside Story Headline\r"},{"id":"360cc726-24d4-5a5b-acd5-0bf47b868bb7","text":"Back Page Story Headline\r"},{"id":"38da7f06-de9f-5b4e-a9fa-b9b9e30f050a","text":"Strictly Jazz\r"},{"id":"3ae957f4-8c26-5598-8d1f-9823367d7825","text":"This story can fit 75-125 words.\rSelecting pictures or graphics is an important part of adding content to your newsletter.\rThink about your article and ask yourself if the picture supports or enhances the message you’re trying to convey. Avoid selecting images that appear to be out of context.\rMicrosoft Publisher includes thousands of clip art images from which you can choose and import into your newsletter. There are also several tools you can use to draw shapes and symbols.\rOnce you have chosen an image, place it close to the article. Be sure to place the caption of the image near the image.\r"},{"id":"3bf556ea-6e50-5c65-b017-eb1c0bbc53dc","text":"Organization\r"},{"id":"41bca7f3-cf42-5329-92b3-ac0552e19685","text":"Striving to Achieve\r"},{"id":"4a4aae9b-3cfe-58aa-b159-ee007af6a539","text":"Caption describing picture or graphic.\r"},{"id":"4c72ebd4-6fe1-5d19-829d-b9e5fe2bbb4a","text":"Volume 1, Issue 1\r"},{"id":"50ea838a-d71b-5f8d-917d-caa3a6e97eb8","text":"“To catch the reader's attention, place an interesting sentence or quote from the story here.”\r"},{"id":"52322820-64da-5ed6-ac6e-37a695e0b30f","text":"Phone: 555-555-0187\rFax: 555-555-0188\rE-mail: someone@example.com\r"},{"id":"5441a0bc-e681-57a2-894c-d0aee145f392","text":"“To catch the reader's attention, place an interesting sentence or quote from the story here.”\r"},{"id":"595548ac-6628-5e8b-a87b-216ae0d649c9","text":"Our Excursion to the Zoo\r"},{"id":"5cc16de1-fab2-5720-96cc-c55ec96c74d6","text":"Living and Learning in Class X\r"},{"id":"5ce16f19-f904-5855-8cc1-22c6b9be28c9","text":"30.3.03\r"},{"id":"5d99265c-f96e-5ae5-a3f9-dfd8b41f9848","text":"Inside Story Headline\r"},{"id":"62090bc3-fc32-5b13-bfeb-5f0debb6a555","text":"Page #\r"},{"id":"63115962-7a96-5d23-8b3f-f3a3a204eb3b","text":"Strive to Achieve\r"},{"id":"6412989a-3f33-561a-b8d7-5d445ce52e71","text":"On Monday, we visited the zoo to learn about animal habitats. \rWe caught the bus from school and arrived in time for recess.\rJosh, the zoo keeper, told us all about the different habitats that animals live in.\rMy favorite was the reptile house. I learned that snakes can live on land, up trees and even in the water. \rWe had a great time at the zoo learning all about what animals need in their environment. \r"},{"id":"7435686e-22f0-52a6-a5b4-74050d6829d6","text":"This story can fit 75-125 words.\rSelecting pictures or graphics is an important part of adding content to your newsletter.\rThink about your article and ask yourself if the picture supports or enhances the message you’re trying to convey. Avoid selecting images that appear to be out of context.\rMicrosoft Publisher includes thousands of clip art images from which you can choose and import into your newsletter. There are also several tools you can use to draw shapes and symbols.\rOnce you have chosen an image, place it close to the article. Be sure to place the caption of the image near the image.\r"},{"id":"7a60f4b6-bbd9-5155-a49e-1cdecb01feb4","text":"This story can fit 100-150 words.\rThe subject matter that appears in newsletters is virtually endless. You can include stories that focus on current technologies or innovations in your field.\rYou may also want to note business or economic trends, or make predictions for your customers or clients.\rIf the newsletter is distributed internally, you might comment upon new procedures or improvements to the business. Sales figures or earnings will show how your business is growing.\rSome newsletters include a column that is updated every issue, for instance, an advice column, a book review, a letter from the president, or an editorial. You can also profile new employees or top customers or vendors.\r"},{"id":"7da0c6ab-6a7c-5171-9baa-97f51fecd7a1","text":"Inside Story Headline\r"},{"id":"7f057d01-4c59-5ac9-a5fa-4f5fee8dd895","text":"Inside Story Headline\r"},{"id":"8b471af6-35a4-5cf4-8355-728ea18f38c5","text":"Caption describing picture or graphic.\r"},{"id":"8e43fd6b-3c92-5ae5-9d1a-3d11c87c8a42","text":"Volume 1, Issue 1\r"},{"id":"902668d7-7275-5e4e-9598-280d9f479198","text":"This would be a good place to insert a short paragraph about your organization. It might include the purpose of the organization, its mission, founding date, and a brief history. You could also include a brief list of the types of products, services, or programs your organization offers, the geographic area covered (for example, western U.S. or European markets), and a profile of the types of customers or members served. \rIt would also be useful to include a contact name for readers who want more information about the organization.\r"},{"id":"9e1b09fb-4739-5ae8-b09e-6531017785b7","text":"This week in class, we have been discussing what it means to be an American. We had to divide into groups of 5 and brainstorm words and ideas that we associate with being American. \r\rOur ideas were recorded in a Microsoft® Visio® mind map. \n\rNext, we got to record ourselves singing the National Anthem on the computer. \n\rThen, we had to look up pictures on the Internet to match the ideas we wrote in our mind maps. That was great fun as we found lots of interesting pictures that we hadn't thought to include initially. \r\rWe put everything together in a Microsoft PowerPoint® presentation. \r\rWhile our recording of the National Anthem played, our pictures that we downloaded with the words we had written down earlier flashed across the screen.\rIt was interesting watching what other groups had come up with in their presentation. We all had a great time learning.\r"},{"id":"a216335c-5e39-52a5-85f0-8a1abeb1819b","text":"What it means to be an American\r\t\t\t\t\t\tBy Paul Koch\rhjhjhlh\r\r"},{"id":"a4448b3c-3770-5a38-ba7c-8d84eb9dd1e3","text":"Caption describing picture or graphic.\r"},{"id":"bd483ac5-06ab-5329-98cb-71b283c15cbc","text":"This story can fit 175-225 words.\rIf your newsletter is folded a